"protocol_id","protocol_group","source_report","source_exists","protocol_requirement","allowed_scope","disallowed_scope","allowed_output","blocked_output","readiness_status","training_allowed_now","formula_evaluation_allowed_now","dataset_merge_allowed_now","candidate_creation","candidate_promotion","production_effect","trading_allowed","notes"
"tiny_protocol_001","input_scope","data/reports/formulaic_alpha_broader_materialized_feature_stage1.csv;data/reports/formulaic_alpha_broader_materialized_feature_stage1_manifest.csv","True","Use Stage 1 feature table only.","50 symbols; 24 feature dates; 6 formulas; 7200 rows; existing feature_hashes only.","Any new symbols, new dates, new formulas, external inputs, or raw-data refetch.","protocol_manifest_only","new_feature_generation_now","DESIGN_ONLY_NOT_EXECUTED","False","False","False","False","False","none","False","Protocol does not run experiment."
"tiny_protocol_002","split_policy","data/reports/purged_embargo_validation_schema_plan.md","True","Use purged/embargo split placeholders before execution.","Define date-grouped split identifiers and no-label-join rules.","Random row split, OOS rerun, post-cutoff leakage, or live-review use.","split_contract_for_future_gate","actual_validation_run_now","DESIGN_ONLY_NOT_EXECUTED","False","False","False","False","False","none","False","Split design only."
"tiny_protocol_003","model_boundary","data/reports/ml_v2_stage1_paper_experiment_gate.md","True","Future experiment may test pipeline mechanics only if a separate execution gate allows it.","At most one simple paper-only baseline learner or blocked no-train report in future gate.","Model selection, hyperparameter sweep, formula ranking, promotion, or production scoring.","future_gate_can_allow_or_block_training","training_now","DESIGN_ONLY_NOT_EXECUTED","False","False","False","False","False","none","False","No learner is trained here."
"tiny_protocol_004","metrics_boundary","data/reports/deflated_sharpe_placeholder_report.md;data/reports/candidate_trial_ledger.md","True","Metrics must not imply selection without data-snooping controls.","Allowed future outputs: row counts, missingness, leakage checks, fit status if separately allowed.","Sharpe, Deflated Sharpe, PnL ranking, candidate comparison, buy/sell recommendations.","schema_and_quality_metrics_only","performance_evaluation_now","DESIGN_ONLY_NOT_EXECUTED","False","False","False","False","False","none","False","Performance metrics are blocked in protocol design."
"tiny_protocol_005","safety_boundary","data/reports/paper_operation_safety_status_index.md;data/reports/post_cutoff_oos_proof_inventory.md","True","Experiment must not affect production or protected candidate.","paper-only report artifacts only; no orders; no broker; no plan regeneration.","Any production readiness change, broker work, real order, or protected candidate change.","paper_only_protocol_report","orders_or_broker_or_production_change","DESIGN_ONLY_NOT_EXECUTED","False","False","False","False","False","none","False","Hard safety gates remain."
"tiny_protocol_summary","summary","multiple","True","Protocol must prepare future gate without executing experiment.","A future POST checkpoint may execute a tiny experiment gate, then only if safety fields remain false.","Any direct experiment execution in POST-03.","future_execution_gate_design_or_report","training_or_evaluation_in_this_loop","DESIGN_ONLY_NOT_EXECUTED","False","False","False","False","False","none","False","POST-03 is protocol design only."
