"refresh_id","readiness_group","source_report","source_exists","previous_status","new_evidence","coverage_status","pit_alignment_status","missingness_status","feature_hash_status","trial_ledger_status","merge_readiness","training_allowed_now","dataset_merge_performed","model_training_performed","candidate_promotion","production_effect","trading_allowed","notes"
"merge_refresh_001","materialized_sample","data/reports/formulaic_alpha_materialized_feature_sample.csv;data/reports/formulaic_alpha_materialized_feature_sample.md","True","BLOCK_NO_FEATURE_VALUES","30 feature rows; 6 feature hashes; 30 feature row hashes","PARTIAL_SAMPLE_ONLY_5_SYMBOLS_1_DATE","PASS_SAMPLE_ONLY","PASS_SAMPLE_ONLY_missing_rows_0","PASS_SAMPLE_ONLY_6_hashes","PASS_existing_cp06_ledger_rows","BLOCK_PARTIAL_SAMPLE_ONLY","False","False","False","False","none","False","Feature materialization improved from none to narrow sample only."
"merge_refresh_002","audit_refresh","data/reports/formulaic_alpha_feature_audit_refresh.csv;data/reports/formulaic_alpha_feature_audit_refresh.md","True","BLOCK","audit_status=PASS_SAMPLE_ONLY_NOT_TRAINING_READY","PARTIAL_SAMPLE_ONLY","PASS_SAMPLE_ONLY","PASS_SAMPLE_ONLY","PASS_SAMPLE_ONLY","PASS_existing_cp06_ledger_rows","BLOCK_PARTIAL_SAMPLE_ONLY","False","False","False","False","none","False","Audit passes for narrow sample but explicitly says not training-ready."
"merge_refresh_003","coverage_gap","data/reports/formulaic_alpha_feature_audit_refresh.md","True","BLOCK","Only 5 symbols and one feature date materialized","BLOCK_NO_FULL_UNIVERSE_DATE_COVERAGE","PASS_SAMPLE_ONLY","PASS_SAMPLE_ONLY","PASS_SAMPLE_ONLY","PASS_existing_cp06_ledger_rows","BLOCK_PARTIAL_SAMPLE_ONLY","False","False","False","False","none","False","Full universe/date coverage is still missing."
"merge_refresh_004","label_and_validation_gap","data/reports/purged_embargo_validation_schema_plan.md;data/reports/formulaic_alpha_materialized_feature_sample.md","True","BLOCK","labels not joined; label_horizon placeholder only","PARTIAL_SAMPLE_ONLY","PASS_SAMPLE_ONLY","PASS_SAMPLE_ONLY","PASS_SAMPLE_ONLY","PASS_existing_cp06_ledger_rows","BLOCK_PARTIAL_SAMPLE_ONLY","False","False","False","False","none","False","Label isolation is good for sample, but no validation-ready feature dataset exists."
"merge_refresh_005","selection_and_evaluation_gap","data/reports/deflated_sharpe_placeholder_report.md;data/reports/candidate_trial_ledger.md","True","BLOCK","No formula evaluation; no Deflated Sharpe; effective_trial_count not_available","PARTIAL_SAMPLE_ONLY","PASS_SAMPLE_ONLY","PASS_SAMPLE_ONLY","PASS_SAMPLE_ONLY","PASS_WITH_PLACEHOLDERS","BLOCK_PARTIAL_SAMPLE_ONLY","False","False","False","False","none","False","No selection or evaluation is allowed from sample materialization."
"merge_refresh_summary","ALL","multiple","True","BLOCK","Sample materialization improves audit evidence but does not unblock merge readiness","PARTIAL_SAMPLE_ONLY_30_ROWS","PASS_SAMPLE_ONLY","PASS_SAMPLE_ONLY","PASS_SAMPLE_ONLY","PASS_WITH_PLACEHOLDERS","BLOCK_PARTIAL_SAMPLE_ONLY","False","False","False","False","none","False","CP-08 remains blocked until full feature coverage and explicit readiness gate exist."
